Symbol,Name,Last Sale,Net Change,% Change,Market Cap,Country,IPO Year,Volume,Sector,Industry
CRON,Cronos Group Inc. Common Share,$2.48,-0.02,-0.80%,951841142.00,Canada,,1512206,Health Care, Medicinal Chemicals and Botanical Products 
CROX,Crocs Inc. Common Stock,$87.19,0.74,0.856%,4762087444.00,United States,2006,1210216,Consumer Discretionary,Shoe Manufacturing
CRSP,CRISPR Therapeutics AG Common Shares,$54.10,-0.76,-1.385%,4920417884.00,Switzerland,2016,1496969,Health Care,Biotechnology: Biological Products (No Diagnostic Substances)
CRSR,Corsair Gaming Inc. Common Stock,$8.90,0.06,0.679%,943729078.00,United States,2020,709572,Technology,Computer peripheral equipment
CRTO,Criteo S.A. American Depositary Shares,$23.75,0.42,1.80%,1242774800.00,France,2013,247253,Consumer Discretionary,Advertising
CRUS,Cirrus Logic Inc. Common Stock,$117.43,1.71,1.478%,6027937663.00,United States,1989,614105,Technology,Semiconductors
CRVL,CorVel Corp. Common Stock,$90.34,4.86,5.686%,4635593654.00,United States,,461910,Finance,Specialty Insurers
CRVO,CervoMed Inc. Common Stock,$9.99,-0.52,-4.948%,92434663.00,United States,,113809,Health Care,Biotechnology: Pharmaceutical Preparations
CRVS,Corvus Pharmaceuticals Inc. Common Stock,$5.90,-0.26,-4.221%,439632830.00,United States,2016,792778,Health Care,Biotechnology: Pharmaceutical Preparations
CRWD,CrowdStrike Holdings Inc. Class A Common Stock,$428.06,10.43,2.497%,107423857228.00,United States,2019,2542596,Technology,Computer Software: Prepackaged Software
CRWS,Crown Crafts Inc Common Stock,$3.05,0.005,0.164%,32223284.00,United States,,149300,Consumer Discretionary,Textiles
CRWV,CoreWeave Inc. Class A Common Stock,$93.55,4.46,5.006%,45705946897.00,United States,2025,24177938,Technology,Computer Software: Prepackaged Software
CSAI,Cloudastructure Inc. Class A Common Stock,$1.37,0.18,15.126%,24712985.00,United States,,530093,Technology,Computer Software: Programming Data Processing
CSBR,Champions Oncology Inc. Common Stock,$6.80,-0.04,-0.585%,93684756.00,United States,,4636,Health Care,Biotechnology: Biological Products (No Diagnostic Substances)
CSCO,Cisco Systems Inc. Common Stock (DE),$66.88,-0.02,-0.03%,264389812217.00,United States,1990,14024707,Telecommunications,Computer Communications Equipment
CSGP,CoStar Group Inc. Common Stock,$88.06,-1.40,-1.565%,37306650878.00,United States,1998,2826596,Real Estate,Real Estate
CSGS,CSG Systems International Inc. Common Stock,$65.18,0.37,0.571%,1875124182.00,United States,1996,538777,Technology,EDP Services
CSIQ,Canadian Solar Inc. Common Shares (ON),$10.92,-0.25,-2.238%,731222801.00,Canada,2006,2045853,Technology,Semiconductors
CSPI,CSP Inc. Common Stock,$11.17,-0.20,-1.759%,110151023.00,United States,1982,20144,Technology,EDP Services
CSQ,Calamos Strategic Total Return Common Stock,$18.76,0.15,0.806%,2980731789.00,United States,2004,170223,Finance,Finance Companies
CSTE,Caesarstone Ltd. Ordinary Shares,$1.39,-0.02,-1.418%,48032600.00,Israel,2012,16027,Industrials,Building Materials
CSTL,Castle Biosciences Inc. Common Stock,$24.06,0.50,2.122%,697939241.00,United States,2019,276639,Health Care,Medical Specialities
CSWC,Capital Southwest Corporation Common Stock,$22.99,0.03,0.131%,1278898249.00,United States,,439787,Consumer Discretionary,Textiles
CSWCZ,Capital Southwest Corporation 7.75% Notes due 2028,$25.522,-0.018,-0.07%,1196239033.00,United States,,8013,Finance,Finance Companies
CSX,CSX Corporation Common Stock,$32.43,-0.10,-0.307%,60458503564.00,United States,,16025206,Industrials,Railroads
CTAS,Cintas Corporation Common Stock,$202.78,-1.72,-0.841%,81715863834.00,United States,1983,2668460,Industrials,Garments and Clothing
CTBI,Community Trust Bancorp Inc. Common Stock,$58.09,-0.28,-0.48%,1052043883.00,United States,,39121,Finance,Major Banks
CTKB,Cytek Biosciences Inc. Common Stock,$4.10,0.08,1.99%,521617490.00,United States,2021,1069517,Industrials,Biotechnology: Laboratory Analytical Instruments
CTLP,Cantaloupe Inc. Common Stock,$10.83,0.02,0.185%,791223143.00,United States,,2432330,Miscellaneous,Office Equipment/Supplies/Services
CTMX,CytomX Therapeutics Inc. Common Stock,$2.18,-0.10,-4.386%,359510135.00,United States,2015,3414905,Health Care,Biotechnology: Pharmaceutical Preparations
CTNM,Contineum Therapeutics Inc. Class A Common Stock,$12.13,0.63,5.478%,340148186.00,United States,2024,355956,Health Care,Biotechnology: Pharmaceutical Preparations
CTNT,Cheetah Net Supply Chain Service Inc. Class A Common Stock,$1.715,0.03,1.78%,4582499.00,United States,2023,15272,Consumer Discretionary,Motor Vehicles
CTOR,Citius Oncology Inc. Common Stock,$1.84,-0.04,-2.128%,144201875.00,United States,2022,266649,Health Care,Biotechnology: Pharmaceutical Preparations
CTRM,Castor Maritime Inc. Common Shares,$1.9268,-0.0432,-2.193%,18617424.00,Cyprus,,54598,Consumer Discretionary,Marine Transportation
CTRN,Citi Trends Inc. Common Stock,$37.82,0.11,0.292%,313681009.00,United States,2005,221707,Consumer Discretionary,Clothing/Shoe/Accessory Stores
CTSH,Cognizant Technology Solutions Corporation Class A Common Stock,$71.19,-0.63,-0.877%,34768906755.00,United States,1998,5198785,Technology,EDP Services
CTSO,Cytosorbents Corporation Common Stock,$0.9824,0.0168,1.74%,61657197.00,United States,,68110,Health Care,Medical/Dental Instruments
CTW,CTW Cayman Class A Ordinary Shares,$1.96,0.00,0.00%,123480000.00,Japan,2025,21744,Technology,EDP Services
CTXR,Citius Pharmaceuticals Inc. Common Stock,$1.22,-0.01,-0.813%,20754873.00,United States,,215734,Health Care,Biotechnology: Pharmaceutical Preparations
CUB,Lionheart Holdings Class A Ordinary Shares,$10.50,0.00,0.00%,333570048.00,United States,2024,2,Industrials,Industrial Machinery/Components
CUBWU,Lionheart Holdings Unit,$10.65,0.00,0.00%,0.00,United States,2024,1,Finance,Blank Checks
CUBWW,Lionheart Holdings Warrant,$0.2402,0.0202,9.182%,0.00,United States,2024,289,,
CUE,Cue Biopharma Inc. Common Stock,$0.777,-0.003,-0.385%,59709267.00,United States,2018,98519,Health Care,Biotechnology: Pharmaceutical Preparations
CUPR,Cuprina Holdings (Cayman) Limited Class A Ordinary Shares,$0.6255,-0.0745,-10.643%,13135500.00,Singapore,2025,387234,Health Care,Biotechnology: Pharmaceutical Preparations
CURI,CuriosityStream Inc. Class A Common Stock,$4.57,0.00,0.00%,264738880.00,United States,2020,876751,Consumer Discretionary,Movies/Entertainment
CURIW,CuriosityStream Inc. Warrant,$0.021,-0.0088,-29.53%,1216524.00,United States,2020,17184,Consumer Discretionary,Movies/Entertainment
CURR,Currenc Group Inc. Ordinary Shares,$1.68,0.01,0.599%,127822254.00,Singapore,,80014,Real Estate,Real Estate
CURX,Curanex Pharmaceuticals Inc Common Stock,$7.45,0.22,3.043%,206737500.00,United States,2025,455941,Health Care,Biotechnology: Pharmaceutical Preparations
CV,CapsoVision Inc. Common Stock,$3.64,0.06,1.676%,170257604.00,United States,2025,34308,Health Care,Biotechnology: Electromedical & Electrotherapeutic Apparatus
CVAC,CureVac N.V. Ordinary Shares,$5.35,-0.04,-0.742%,1200209675.00,Germany,2020,432621,Health Care,Biotechnology: Pharmaceutical Preparations
CVBF,CVB Financial Corporation Common Stock,$20.20,-0.12,-0.591%,2783915500.00,United States,,644342,Finance,Major Banks
CVCO,Cavco Industries Inc. Common Stock When Issued,$546.19,0.35,0.064%,4324539615.00,United States,,166618,Consumer Discretionary,Homebuilding
CVGI,Commercial Vehicle Group Inc. Common Stock,$1.82,-0.02,-1.087%,67386326.00,United States,2004,83772,Consumer Discretionary,Auto Parts:O.E.M.
CVGW,Calavo Growers Inc. Common Stock,$27.21,0.03,0.11%,485349450.00,United States,,158883,Consumer Discretionary,Specialty Foods
CVKD,Cadrenal Therapeutics Inc. Common Stock,$13.37,0.125,0.944%,27366438.00,United States,2023,15210,Health Care,Biotechnology: Pharmaceutical Preparations
CVLT,Commvault Systems Inc. Common Stock,$183.96,4.99,2.788%,8178798870.00,United States,2006,850674,Technology,Computer Software: Prepackaged Software
CVRX,CVRx Inc. Common Stock,$7.95,0.13,1.662%,207906206.00,United States,2021,96646,Health Care,Medical/Dental Instruments
CVV,CVD Equipment Corporation Common Stock,$2.79,0.02,0.722%,19200328.00,United States,,29776,Technology,Industrial Machinery/Components
CWBC,Community West Bancshares Common Stock,$21.23,0.005,0.024%,406140685.00,United States,,41451,Finance,Major Banks
CWCO,Consolidated Water Co. Ltd. Ordinary Shares,$33.52,-0.27,-0.799%,533866370.00,Cayman Islands,,102567,Utilities,Water Supply
CWD,CaliberCos Inc. Class A Common Stock,$2.15,0.07,3.365%,5192332.00,United States,2023,232582,Finance,Real Estate
CWST,Casella Waste Systems Inc. Class A Common Stock,$93.24,-1.45,-1.531%,5919850770.00,United States,1997,558764,Utilities,Environmental Services
CXAI,CXApp Inc. Class A Common Stock,$0.7207,-0.0115,-1.571%,16889773.00,United States,2021,890355,Technology,EDP Services
CXAIW,CXApp Inc. Warrant,$0.0986,0.0006,0.612%,2310714.00,United States,2021,4290,Technology,EDP Services
CXDO,Crexendo Inc. Common Stock,$6.42,-0.17,-2.58%,193688389.00,United States,,136521,Telecommunications,Telecommunications Equipment
CYBR,CyberArk Software Ltd. Ordinary Shares,$468.80,6.03,1.303%,23186244654.00,Israel,2014,618084,Technology,Computer Software: Prepackaged Software
CYCC,Cyclacel Pharmaceuticals Inc. Common Stock,$7.05,-0.07,-0.983%,15784837.00,United States,,34836,Health Care,Biotechnology: Pharmaceutical Preparations
CYCCP,Cyclacel Pharmaceuticals Inc. 6% Convertible Preferred Stock,$4.84,0.04,0.833%,10836683.00,United States,,2941,Health Care,Biotechnology: Pharmaceutical Preparations
CYCN,Cyclerion Therapeutics Inc. Common Stock,$2.26,0.0447,2.018%,7542605.00,United States,,26034,Health Care,Biotechnology: Pharmaceutical Preparations
CYCU,Cycurion Inc. Common Stock,$0.1827,0.0025,1.387%,9395537.00,United States,2025,7163611,Technology,EDP Services
CYCUW,Cycurion Inc. Warrant,$0.0439,0.0008,1.856%,2257603.00,United States,2025,140986,Technology,EDP Services
CYN,Cyngn Inc. Common Stock,$5.30,-0.35,-6.195%,37308110.00,United States,2021,225753,Technology,EDP Services
CYRX,CryoPort Inc. Common Stock,$10.04,-0.31,-2.995%,502672359.00,United States,,807661,Health Care,Biotechnology: Pharmaceutical Preparations
CYTK,Cytokinetics Incorporated Common Stock,$52.09,-0.92,-1.736%,6232941256.00,United States,2004,2556763,Health Care,Biotechnology: Pharmaceutical Preparations
CZFS,Citizens Financial Services Inc. Common Stock,$62.67,1.26,2.052%,301274368.00,United States,,10185,Finance,Major Banks
CZNC,Citizens & Northern Corp Common Stock,$20.25,0.085,0.422%,314177596.00,United States,,28745,Finance,Major Banks
CZR,Caesars Entertainment Inc. Common Stock,$26.38,0.04,0.152%,5486816799.00,United States,,7194900,Consumer Discretionary,Hotels/Resorts
CZWI,Citizens Community Bancorp Inc. Common Stock,$16.50,0.01,0.061%,162859736.00,United States,2006,13287,Finance,Savings Institutions
DAAQ,Digital Asset Acquisition Corp. Class A Ordinary shares,$10.15,0.03,0.296%,0.00,United States,2025,25928,,
DAAQU,Digital Asset Acquisition Corp. Units,$10.5486,0.0286,0.272%,0.00,United States,2025,2409,Finance,Blank Checks
DAAQW,Digital Asset Acquisition Corp. Warrant,$0.7781,-0.0419,-5.11%,0.00,United States,2025,10169,,
DAIC,CID HoldCo Inc. Common Stock,$3.90,-0.15,-3.704%,107784062.00,United States,,91912,Technology,EDP Services
DAICW,CID HoldCo Inc. Warrants,$0.174,0.006,3.571%,4808827.00,United States,,21222,Technology,EDP Services
DAIO,Data I/O Corporation Common Stock,$3.20,-0.01,-0.312%,30040522.00,United States,1981,33562,Industrials,Electrical Products
DAKT,Daktronics Inc. Common Stock,$17.62,0.24,1.381%,865376029.00,United States,1994,286663,Consumer Discretionary,Miscellaneous manufacturing industries
DALN,DallasNews Corporation Series A Common Stock,$14.80,-0.05,-0.337%,79216852.00,United States,,31781,Consumer Discretionary,Newspapers/Magazines
DARE,Dare Bioscience Inc. Common Stock,$2.13,-0.02,-0.93%,28711339.00,United States,2014,142984,Health Care,Biotechnology: Pharmaceutical Preparations
DASH,DoorDash Inc. Class A Common Stock,$250.60,3.75,1.519%,107055024899.00,United States,,3332487,Technology,EDP Services
DAVE,Dave Inc. Class A Common Stock,$195.20,0.55,0.283%,2660509242.00,United States,,364495,Finance,Finance: Consumer Services
DAVEW,Dave Inc. Warrants,$1.1099,-0.0401,-3.487%,15127557.00,United States,,48051,Finance,Finance: Consumer Services
DAWN,Day One Biopharmaceuticals Inc. Common Stock,$7.47,-0.08,-1.06%,765166540.00,United States,2021,875600,Health Care,Biotechnology: Pharmaceutical Preparations
DBGI,Digital Brands Group Inc. Common Stock,$8.965,0.5149,6.093%,40264693.00,United States,2025,69337,Consumer Discretionary,Clothing/Shoe/Accessory Stores
DBVT,DBV Technologies S.A. American Depositary Shares,$8.70,-0.266,-2.967%,238334229.00,France,2014,15883,Health Care,Biotechnology: Biological Products (No Diagnostic Substances)
DBX,Dropbox Inc. Class A Common Stock,$30.34,0.47,1.573%,8187585349.00,United States,2018,3462645,Technology,Computer Software: Prepackaged Software
DCBO,Docebo Inc. Common Shares,$31.79,0.61,1.956%,913111196.00,Canada,,130372,Technology,Computer Software: Prepackaged Software
DCGO,DocGo Inc. Common Stock,$1.57,-0.01,-0.633%,153558775.00,United States,2020,446578,Health Care,Medical/Nursing Services
DCOM,Dime Community Bancshares Inc. Common Stock,$31.00,0.37,1.208%,1360624038.00,United States,,207444,Finance,Major Banks
DCOMG,Dime Community Bancshares Inc. 9.000% Fixed-to-Floating Rate Subordinated Notes due 2034,$26.15,-0.15,-0.57%,1023736858.00,United States,,2269,Finance,Major Banks
DCOMP,Dime Community Bancshares Inc. Fixed-Rate Non-Cumulative Perpetual Preferred Stock Series A,$19.80,0.20,1.02%,869043740.00,United States,,7341,Finance,Major Banks
DCTH,Delcath Systems Inc. Common Stock,$11.55,-0.10,-0.858%,404033472.00,United States,,517503,Health Care,Medical/Dental Instruments
DDI,DoubleDown Interactive Co. Ltd. American Depository Shares,$9.53,-0.02,-0.209%,472244283.00,South Korea,2021,41954,Technology,EDP Services
DDOG,Datadog Inc. Class A Common Stock,$136.44,0.36,0.265%,47582784991.00,United States,2019,4756915,Technology,Computer Software: Prepackaged Software
DEFT,Defi Technologies Inc. Common Stock,$2.12,0.09,4.433%,710459997.00,Canada,,2548791,Finance,Finance: Consumer Services
DENN,Denny's Corporation Common Stock,$4.90,0.29,6.291%,252345071.00,United States,,1343963,Consumer Discretionary,Restaurants
DERM,Journey Medical Corporation Common Stock,$7.01,0.00,0.00%,170891084.00,United States,2021,62595,Health Care,Biotechnology: Pharmaceutical Preparations
DEVS,DevvStream Corp. Common Stock,$2.26,-0.06,-2.586%,8004181.00,Canada,2024,100488,Finance,Finance/Investors Services
DFDV,DeFi Development Corp. Common Stock,$15.00,0.04,0.267%,315675735.00,United States,2023,2230953,Finance,Finance: Consumer Services
DFLI,Dragonfly Energy Holdings Corp. Common Stock (NV),$0.2617,-0.0133,-4.836%,16153326.00,United States,2021,3741323,Miscellaneous,Industrial Machinery/Components
DFLIW,Dragonfly Energy Holdings Corp. Warrant,$0.0267,0.00,0.00%,1648047.00,United States,2021,69742,Miscellaneous,Industrial Machinery/Components
DFSC,DEFSEC Technologies Inc. Common Stock,$3.02,0.01,0.332%,4216889.00,Canada,,26538,Technology,Computer Software: Prepackaged Software
DFSCW,DEFSEC Technologies Inc. Warrant,$0.0345,0.0015,4.545%,48173.00,Canada,,1044,Technology,Computer Software: Prepackaged Software
DGICA,Donegal Group Inc. Class A Common Stock,$19.29,0.43,2.28%,704251453.00,United States,,200325,Finance,Property-Casualty Insurers
DGICB,Donegal Group Inc. Class B Common Stock,$16.72,1.84,12.366%,610424277.00,United States,1986,912,Finance,Property-Casualty Insurers
DGII,Digi International Inc. Common Stock,$34.60,-0.09,-0.259%,1284427497.00,United States,1989,245867,Telecommunications,Computer Communications Equipment
DGLY,Digital Ally Inc. Common Stock,$1.83,0.06,3.39%,3161180.00,United States,,79579,Technology,Radio And Television Broadcasting And Communications Equipment
DGNX,Diginex Limited Ordinary Shares,$64.54,-0.65,-0.997%,11872139712.00,Hong Kong,2025,16456,Technology,EDP Services
DGXX,Digi Power X Inc. Subordinate Voting Shares,$2.21,-0.27,-10.887%,98803893.00,Canada,,969485,Finance,Finance: Consumer Services
DH,Definitive Healthcare Corp. Class A Common Stock,$4.15,0.15,3.75%,431957772.00,United States,2021,321981,Technology,Computer Software: Prepackaged Software
DHAI,DIH Holdings US Inc. Class A Common Stock,$0.2229,-0.0219,-8.946%,10551262.00,United States,2024,5710072,Health Care,Medical/Dental Instruments
DHAIW,DIH Holding US Inc. Warrants,$0.0153,-0.0015,-8.929%,724245.00,United States,2024,28501,Health Care,Medical/Dental Instruments
DHC,Diversified Healthcare Trust Common Shares of Beneficial Interest,$4.29,0.17,4.126%,1035667592.00,United States,,1629648,Real Estate,Real Estate Investment Trusts
DHCNI,Diversified Healthcare Trust 5.625% Senior Notes due 2042,$17.74,0.24,1.371%,4282690693.00,United States,,33348,Real Estate,Real Estate Investment Trusts
DHCNL,Diversified Healthcare Trust 6.25% Senior Notes Due 2046,$18.47,0.27,1.484%,4458923174.00,United States,,21217,Real Estate,Real Estate Investment Trusts
DHIL,Diamond Hill Investment Group Inc. Class A Common Stock,$141.47,-1.03,-0.723%,385528102.00,United States,,13403,Finance,Investment Managers
DIBS,1stdibs.com Inc. Common Stock,$2.80,0.03,1.083%,101490505.00,United States,2021,149313,Consumer Discretionary,Catalog/Specialty Distribution
DIOD,Diodes Incorporated Common Stock,$53.25,0.19,0.358%,2473075639.00,United States,,417768,Technology,Semiconductors
DJCO,Daily Journal Corp. (S.C.) Common Stock,$489.90,-0.71,-0.145%,674800997.00,United States,,35723,Consumer Discretionary,Newspapers/Magazines
DJT,Trump Media & Technology Group Corp. Common Stock,$17.05,0.37,2.218%,4723999102.00,United States,2024,7164484,Technology,Computer Software: Programming Data Processing
DJTWW,Trump Media & Technology Group Corp. Warrants,$9.02,0.0784,0.877%,2499147912.00,United States,2021,24854,Technology,Computer Software: Programming Data Processing
DKI,DarkIris Inc. Class A Ordinary Shares,$4.99,0.19,3.958%,87325000.00,Hong Kong,2025,332888,Technology,Computer Software: Prepackaged Software
DKNG,DraftKings Inc. Class A Common Stock,$46.32,-0.24,-0.515%,22996493689.00,United States,2019,7795971,Consumer Discretionary,Services-Misc. Amusement & Recreation
DLHC,DLH Holdings Corp.,$5.76,-0.09,-1.538%,82866056.00,United States,,18527,Consumer Discretionary,Professional Services
DLO,DLocal Limited Class A Common Shares,$13.36,-0.06,-0.447%,3813947817.00,Uruguay,2021,2897640,Real Estate,Real Estate
DLPN,Dolphin Entertainment Inc. Common Stock,$1.16,-0.04,-3.333%,13615760.00,United States,,30408,Consumer Discretionary,Other Consumer Services
DLTH,Duluth Holdings Inc. Class B Common Stock,$3.85,0.06,1.583%,144678611.00,United States,2015,906901,Consumer Discretionary,Clothing/Shoe/Accessory Stores
DLTR,Dollar Tree Inc. Common Stock,$99.40,-1.72,-1.701%,20274403495.00,United States,1995,7463869,Consumer Discretionary,Department/Specialty Retail Stores
DLXY,Delixy Holdings Limited Ordinary Shares,$5.13,0.11,2.191%,83875500.00,Singapore,2025,63618,,
DMAA,Drugs Made In America Acquisition Corp. Ordinary Shares,$10.29,0.03,0.292%,0.00,United States,2025,650,,
DMAAR,Drugs Made In America Acquisition Corp. Rights,$0.18,0.00,0.00%,0.00,United States,2025,10926,Finance,Blank Checks
DMAC,DiaMedica Therapeutics Inc. Common Stock,$7.16,1.02,16.612%,370092617.00,United States,2018,2130523,Health Care,Biotechnology: Pharmaceutical Preparations
DMLP,Dorchester Minerals L.P. Common Units Representing Limited Partnership Interests,$24.65,-0.26,-1.044%,1166924985.00,United States,,130098,Energy,Oil & Gas Production
DMRC,Digimarc Corporation Common Stock,$8.58,0.24,2.878%,186026223.00,United States,,130824,Technology,EDP Services
DNLI,Denali Therapeutics Inc. Common Stock,$15.50,0.07,0.454%,2266290309.00,United States,2017,2176239,Health Care,Biotechnology: Biological Products (No Diagnostic Substances)
DNTH,Dianthus Therapeutics Inc. Common Stock,$31.80,5.30,20.00%,1023589371.00,United States,2018,5962946,Health Care,Biotechnology: Pharmaceutical Preparations
DNUT,Krispy Kreme Inc. Common Stock,$3.15,-0.23,-6.805%,539280000.00,United States,2021,4593425,Consumer Staples,Food Chains
DOCU,DocuSign Inc. Common Stock,$81.73,1.87,2.342%,16514590356.00,United States,1989,5076471,Technology,Computer Software: Prepackaged Software
DOGZ,Dogness (International) Corporation Class A Common Stock,$11.58,0.18,1.579%,147421020.00,China,2017,219835,Consumer Discretionary,Miscellaneous manufacturing industries
DOMH,Dominari Holdings Inc. Common Stock,$6.09,0.24,4.103%,93289287.00,United States,,121362,Health Care,Biotechnology: Pharmaceutical Preparations
DOMO,Domo Inc. Class B Common Stock,$15.07,0.45,3.078%,606342475.00,United States,2018,575813,Technology,Computer Software: Prepackaged Software
DOOO,BRP Inc. (Recreational Products) Common Subordinate Voting Shares,$68.36,2.86,4.366%,4993088502.00,Canada,,362196,Consumer Discretionary,Industrial Specialties
DORM,Dorman Products Inc. Common Stock,$166.34,2.67,1.631%,5079065981.00,United States,,182798,Consumer Discretionary,Auto Parts:O.E.M.
DOX,Amdocs Limited Ordinary Shares,$85.80,-0.20,-0.233%,9686010391.00,Guernsey,,728445,Technology,EDP Services
DOYU,DouYu International Holdings Limited ADS,$8.02,0.27,3.484%,242034449.00,China,2019,70234,Technology,Computer Software: Programming Data Processing
DPRO,Draganfly Inc. Common Shares,$4.56,0.20,4.587%,101397692.00,Canada,,884827,Industrials,Aerospace
DPZ,Domino's Pizza Inc Common Stock,$466.105,2.275,0.49%,15823761823.00,United States,2004,527671,Consumer Discretionary,Food Distributors
DRCT,Direct Digital Holdings Inc. Class A Common Stock,$0.425,-0.0101,-2.321%,9569890.00,United States,2022,166655,Consumer Discretionary,Advertising
DRDB,Roman DBDR Acquisition Corp. II Ordinary shares,$10.28,0.00,0.00%,0.00,United States,2025,712,,
DRDBU,Roman DBDR Acquisition Corp. II Unit,$10.50,0.00,0.00%,0.00,United States,2024,4890,,
DRDBW,Roman DBDR Acquisition Corp. II Warrants,$0.50,0.00,0.00%,0.00,United States,2025,5,,
DRIO,DarioHealth Corp. Common Stock,$9.20,-0.40,-4.167%,22078427.00,Israel,,5546,Health Care,Medical/Dental Instruments
DRMA,Dermata Therapeutics Inc. Common Stock,$5.26,0.0031,0.059%,3584990.00,United States,2021,8735,Health Care,Biotechnology: Pharmaceutical Preparations
DRMAW,Dermata Therapeutics Inc. Warrant,$0.0222,0.00,0.00%,15131.00,United States,2021,1400,Health Care,Biotechnology: Pharmaceutical Preparations
DRRX,DURECT Corporation Common Stock,$1.96,0.05,2.618%,60866207.00,United States,2000,811837,Health Care,Biotechnology: Pharmaceutical Preparations
DRS,Leonardo DRS Inc. Common Stock,$41.05,-0.15,-0.364%,10924375176.00,Israel,,807816,Industrials,Industrial Machinery/Components
DRTS,Alpha Tau Medical Ltd. Ordinary Shares,$3.69,0.09,2.50%,259704303.00,Israel,,69392,Health Care,Medical/Dental Instruments
DRTSW,Alpha Tau Medical Ltd. Warrant,$0.2761,-0.0299,-9.771%,19432075.00,Israel,,2238,Health Care,Medical/Dental Instruments
DRUG,Bright Minds Biosciences Inc. Common Stock,$42.97,0.73,1.728%,304426938.00,Canada,,99061,Health Care,Biotechnology: Pharmaceutical Preparations
DRVN,Driven Brands Holdings Inc. Common Stock,$18.92,0.00,0.00%,3108176673.00,United States,2021,1150950,Consumer Discretionary,Automotive Aftermarket
DSGN,Design Therapeutics Inc. Common Stock,$5.82,-0.63,-9.767%,331438093.00,United States,2021,260094,Health Care,Biotechnology: Pharmaceutical Preparations
DSGR,Distribution Solutions Group Inc. Common Stock,$32.00,0.02,0.063%,1480802976.00,United States,,61258,Consumer Discretionary,Industrial Specialties
DSGX,Descartes Systems Group Inc. (The) Common Stock,$107.44,-0.35,-0.325%,9232911839.00,Canada,,402323,Technology,Computer Software: Prepackaged Software
DSP,Viant Technology Inc. Class A Common Stock,$10.31,0.01,0.097%,649026181.00,United States,2021,128318,Technology,Computer Software: Programming Data Processing
DSWL,Deswell Industries Inc. Common Shares,$4.25,0.1049,2.531%,67724766.00,Macau,1995,17940,Industrials,Plastic Products
DSY,Big Tree Cloud Holdings Limited Ordinary Shares,$1.02,0.0013,0.128%,58222157.00,China,,7185,Consumer Discretionary,Containers/Packaging
DSYWW,Big Tree Cloud Holdings Limited Warrants,$0.0198,0.0032,19.277%,1130195.00,China,,192854,Consumer Discretionary,Containers/Packaging
DTCK,Davis Commodities Limited Class A Ordinary Shares,$0.93,0.001,0.108%,22785581.00,Singapore,2023,72750,Industrials,Farming/Seeds/Milling
DTI,Drilling Tools International Corporation Common Stock,$1.96,0.00,0.00%,69896142.00,United States,2021,61315,Consumer Discretionary,Oil and Gas Field Machinery
DTIL,Precision BioSciences Inc. Common Stock,$4.97,-0.10,-1.972%,58581345.00,United States,2019,52195,Health Care,Biotechnology: Biological Products (No Diagnostic Substances)
DTSQ,DT Cloud Star Acquisition Corporation Ordinary Shares,$10.47,0.015,0.143%,0.00,United States,2024,30269,,
DTSQR,DT Cloud Star Acquisition Corporation Right,$0.1308,0.00,0.00%,0.00,United States,2024,101,,
DTSS,Datasea Inc. Common Stock,$2.08,0.0438,2.151%,15920052.00,China,,68966,Technology,Computer Software: Prepackaged Software
DTST,Data Storage Corporation Common Stock,$4.53,0.07,1.57%,32898835.00,United States,,35420,Technology,EDP Services
DTSTW,Data Storage Corporation Warrant,$0.225,0.0057,2.599%,1634048.00,United States,,2242,Technology,EDP Services
DUO,Fangdd Network Group Ltd. Class A Ordinary Shares,$5.07,1.63,47.384%,19796145.00,China,2019,12214641,Finance,Real Estate
DUOL,Duolingo Inc. Class A Common Stock,$271.28,0.10,0.037%,12430566931.00,United States,2021,1491527,Technology,Computer Software: Prepackaged Software
DUOT,Duos Technologies Group Inc. Common Stock,$6.69,-0.02,-0.298%,129881667.00,United States,,294359,Technology,Computer Software: Prepackaged Software
