Symbol,Name,Last Sale,Net Change,% Change,Market Cap,Country,IPO Year,Volume,Sector,Industry
RANG,Range Capital Acquisition Corp. Ordinary Shares,$10.25,0.00,0.00%,0.00,United States,2025,12,,
RANGR,Range Capital Acquisition Corp. Rights,$0.1801,0.0001,0.056%,0.00,United States,2025,1230,,
RANGU,Range Capital Acquisition Corp. Units,$11.00,0.25,2.326%,0.00,United States,2024,100,,
RANI,Rani Therapeutics Holdings Inc. Class A Common Stock,$0.50,-0.0022,-0.438%,35934294.00,United States,2021,215645,Health Care,Biotechnology: Pharmaceutical Preparations
RAPP,Rapport Therapeutics Inc. Common Stock,$31.47,17.11,119.15%,1148589542.00,United States,2024,13868606,Health Care,Biotechnology: Pharmaceutical Preparations
RAPT,RAPT Therapeutics Inc. Common Stock,$13.28,0.35,2.707%,219621904.00,United States,2019,105718,Health Care,Biotechnology: Pharmaceutical Preparations
RARE,Ultragenyx Pharmaceutical Inc. Common Stock,$31.51,-0.31,-0.974%,3036670471.00,United States,2014,1344426,Health Care,Biotechnology: Pharmaceutical Preparations
RAVE,Rave Restaurant Group Inc. Common Stock,$3.41,-0.01,-0.292%,48461440.00,United States,,25698,Consumer Discretionary,Food Distributors
RAY,Raytech Holding Limited Ordinary Shares,$0.5154,-0.0666,-11.443%,22470452.00,Hong Kong,2024,4550142,Consumer Discretionary,Consumer Electronics/Appliances
RAYA,Erayak Power Solution Group Inc. Class A Ordinary Shares,$0.0388,-0.0057,-12.809%,1962824.00,China,2022,62364014,Consumer Discretionary,Metal Fabrications
RBB,RBB Bancorp Common Stock,$19.91,0.00,0.00%,343463966.00,United States,2017,34068,Finance,Major Banks
RBBN,Ribbon Communications Inc. Common Stock,$4.06,0.07,1.754%,718952299.00,United States,,448825,Technology,EDP Services
RBCAA,Republic Bancorp Inc. Class A Common Stock,$77.06,0.23,0.299%,1505022179.00,United States,1998,16978,Finance,Major Banks
RBKB,Rhinebeck Bancorp Inc. Common Stock,$13.28,-0.34,-2.496%,147478782.00,United States,2019,2329,Finance,Banks
RBNE,Robin Energy Ltd. Common Stock,$1.845,-0.035,-1.862%,4403521.00,Cyprus,,100537,Consumer Discretionary,Marine Transportation
RCAT,Red Cat Holdings Inc. Common Stock,$8.87,0.35,4.108%,884908951.00,United States,,5334493,Technology,Computer Software: Prepackaged Software
RCEL,Avita Medical Inc. Common Stock,$4.21,-0.05,-1.174%,112065712.00,United States,,320297,Health Care,Medical/Dental Instruments
RCKT,Rocket Pharmaceuticals Inc. Common Stock,$3.26,-0.02,-0.61%,351766619.00,United States,2015,1290243,Health Care,Biotechnology: Pharmaceutical Preparations
RCKTW,Rocket Pharmaceuticals Inc. Warrant,$0.0401,0.001,2.558%,4326945.00,United States,,22702,Health Care,Biotechnology: Pharmaceutical Preparations
RCKY,Rocky Brands Inc. Common Stock,$29.67,0.55,1.889%,221585677.00,United States,1993,70701,Consumer Discretionary,Shoe Manufacturing
RCMT,RCM Technologies Inc. Common Stock,$27.455,0.045,0.164%,203455552.00,United States,,36602,Consumer Discretionary,Professional Services
RCON,Recon Technology Ltd. Class A Ordinary Shares,$1.99,0.01,0.505%,30025038.00,China,2009,21838,Energy,Oilfield Services/Equipment
RCT,RedCloud Holdings plc Ordinary Shares,$1.28,-0.09,-6.569%,56610093.00,United Kingdom,2025,253472,Consumer Discretionary,Other Specialty Stores
RDAC,Rising Dragon Acquisition Corp. Ordinary Shares,$10.38,0.00,0.00%,0.00,China,2024,36,,
RDACR,Rising Dragon Acquisition Corp. Rights,$0.1599,0.0001,0.063%,0.00,China,2024,15002,Finance,Blank Checks
RDAG,Republic Digital Acquisition Company Class A Ordinary Shares,$10.24,0.02,0.196%,0.00,United States,2025,1834,Finance,Blank Checks
RDAGW,Republic Digital Acquisition Company Warrants,$0.73,0.08,12.308%,0.00,United States,2025,1888,Finance,Blank Checks
RDCM,Radcom Ltd. Ordinary Shares,$14.25,0.535,3.901%,226797528.00,Israel,1997,86648,Technology,Computer peripheral equipment
RDGT,Ridgetech Inc. Ordinary Shares,$1.4551,0.0721,5.213%,8519624.00,China,,45170,Consumer Staples,Retail-Drug Stores and Proprietary Stores
RDHL,Redhill Biopharma Ltd. American Depositary Shares,$1.44,0.0065,0.453%,3299838.00,Israel,,59070,Health Care,Biotechnology: Pharmaceutical Preparations
RDI,Reading International Inc Class A Common Stock,$1.54,0.05,3.356%,34984580.00,United States,,31534,Consumer Discretionary,Movies/Entertainment
RDIB,Reading International Inc Class B Common Stock,$12.31,-0.64,-4.942%,279649471.00,United States,,5431,Consumer Discretionary,Movies/Entertainment
RDNT,RadNet Inc. Common Stock,$71.99,0.58,0.812%,5537187303.00,United States,,561224,Health Care,Medical Specialities
RDNW,RideNow Group Inc. Class B Common Stock,$3.83,-0.11,-2.792%,145740776.00,United States,,44042,Technology,EDP Services
RDVT,Red Violet Inc. Common Stock ,$51.13,0.45,0.888%,714681744.00,United States,,268150,Technology,Computer Software: Prepackaged Software
RDWR,Radware Ltd. Ordinary Shares,$25.55,0.54,2.159%,1090640944.00,Israel,1999,96721,Real Estate,Real Estate
RDZN,Roadzen Inc. Ordinary Shares,$0.9384,-0.0391,-4.00%,71338815.00,United States,2022,150087,Finance,Specialty Insurers
RDZNW,Roadzen Inc. Warrants,$0.055,-0.001,-1.786%,4181197.00,United States,2022,400,Finance,Specialty Insurers
REAL,The RealReal Inc. Common Stock,$8.23,-0.44,-5.075%,948402781.00,United States,2019,3387606,Consumer Discretionary,Other Specialty Stores
REAX,The Real Brokerage Inc. Common Shares,$5.08,-0.17,-3.238%,1063244000.00,Canada,,1674266,Finance,Real Estate
REBN,Reborn Coffee Inc. Common Stock,$2.39,0.04,1.702%,12929221.00,United States,2022,41223,Consumer Discretionary,Restaurants
RECT,Rectitude Holdings Ltd Ordinary Shares,$3.70,-1.04,-21.941%,53650000.00,Singapore,2024,457447,Consumer Discretionary,Industrial Machinery/Components
REE,REE Automotive Ltd. Class A Ordinary Shares,$0.67,-0.0008,-0.119%,20784024.00,Israel,,56241,Industrials,Auto Manufacturing
REFI,Chicago Atlantic Real Estate Finance Inc. Common Stock,$14.25,-0.15,-1.042%,300313406.00,United States,2021,161211,Real Estate,Real Estate Investment Trusts
REFR,Research Frontiers Incorporated Common Stock,$1.30,0.01,0.775%,43742687.00,United States,,4884,Miscellaneous,Multi-Sector Companies
REG,Regency Centers Corporation Common Stock,$73.08,-0.60,-0.814%,13267916187.00,United States,1993,1097757,Real Estate,Real Estate Investment Trusts
REGCO,Regency Centers Corporation 5.875% Series B Cumulative Redeemable Preferred Stock,$22.5563,-0.0937,-0.414%,4095171017.00,United States,,1072,Real Estate,Real Estate Investment Trusts
REGCP,Regency Centers Corporation 6.25% Series A Cumulative Redeemable Preferred Stock,$23.87,0.06,0.252%,4333677605.00,United States,,5408,Real Estate,Real Estate Investment Trusts
REGN,Regeneron Pharmaceuticals Inc. Common Stock,$558.44,-14.94,-2.606%,59187627110.00,United States,1991,1250378,Health Care,Biotechnology: Pharmaceutical Preparations
REKR,Rekor Systems Inc. Common Stock,$1.10,0.01,0.917%,138967437.00,United States,,1106805,Telecommunications,Telecommunications Equipment
RELI,Reliance Global Group Inc. Common Stock,$0.7722,-0.0701,-8.322%,3356023.00,United States,,879692,Finance,Specialty Insurers
RELIW,Reliance Global Group Inc. Series A Warrants,$0.036,-0.0001,-0.277%,156458.00,United States,,2000,Finance,Specialty Insurers
RELL,Richardson Electronics Ltd. Common Stock,$9.63,-0.14,-1.433%,139560878.00,United States,1983,49841,Technology,Electronic Components
RELY,Remitly Global Inc. Common Stock,$19.93,0.44,2.258%,4109430815.00,United States,2021,3935012,Real Estate,Real Estate
RENB,Renovaro Inc. Common Stock,$0.1881,-0.0184,-8.91%,32375503.00,United States,,1632650,Health Care,Biotechnology: Pharmaceutical Preparations
RENT,Rent the Runway Inc. Class A Common Stock,$6.38,0.32,5.281%,25659645.00,United States,2021,121951,Consumer Discretionary,Other Specialty Stores
REPL,Replimune Group Inc. Common Stock,$6.04,-0.29,-4.581%,471457310.00,United States,2018,2466929,Health Care,Biotechnology: Biological Products (No Diagnostic Substances)
RETO,ReTo Eco-Solutions Inc. Class A Shares,$2.20,0.3586,19.474%,16860534.00,China,2017,120978,Industrials,Industrial Machinery/Components
REVB,Revelation Biosciences Inc. Common Stock,$2.82,-0.05,-1.742%,4792976.00,United States,2020,84663,Health Care,Biotechnology: Pharmaceutical Preparations
REVBW,Revelation Biosciences Inc. Warrant,$0.0139,-0.0005,-3.472%,23625.00,United States,2020,12151,Health Care,Biotechnology: Pharmaceutical Preparations
REYN,Reynolds Consumer Products Inc. Common Stock,$22.96,-0.83,-3.489%,4829063607.00,United States,2020,1043233,Consumer Discretionary,Containers/Packaging
RFAI,RF Acquisition Corp II Ordinary Shares,$10.62,0.01,0.094%,0.00,Singapore,2024,1131,,
RFAIR,RF Acquisition Corp II Right,$0.0899,0.0259,40.469%,0.00,Singapore,2024,203999,Technology,Computer Software: Prepackaged Software
RFIL,RF Industries Ltd. Common Stock,$7.32,0.295,4.199%,78094540.00,United States,,63163,Technology,Electrical Products
RGC,Regencell Bioscience Holdings Limited Ordinary Shares,$13.43,0.17,1.282%,6640932905.00,Hong Kong,2021,176860,Health Care, Medicinal Chemicals and Botanical Products 
RGCO,RGC Resources Inc. Common Stock,$22.00,-0.46,-2.048%,227161308.00,United States,,18558,Utilities,Oil & Gas Production
RGEN,Repligen Corporation Common Stock,$120.70,-3.86,-3.099%,6790294493.00,United States,1986,782729,Health Care,Biotechnology: Biological Products (No Diagnostic Substances)
RGLD,Royal Gold Inc. Common Stock,$186.43,1.57,0.849%,12272842569.00,United States,,784845,Industrials,Precious Metals
RGNX,REGENXBIO Inc. Common Stock,$9.48,-0.23,-2.369%,478874768.00,United States,2015,432176,Health Care,Biotechnology: Biological Products (No Diagnostic Substances)
RGP,Resources Connection Inc. Common Stock,$5.15,0.15,3.00%,171700397.00,United States,,242905,Real Estate,Real Estate
RGS,Regis Corporation Common Stock,$26.135,1.965,8.13%,63664363.00,United States,1991,36245,Consumer Discretionary,Other Consumer Services
RGTI,Rigetti Computing Inc. Common Stock,$15.15,0.05,0.331%,4911102326.00,United States,,24878770,Technology,EDP Services
RGTIW,Rigetti Computing Inc. Warrants,$5.60,0.0162,0.29%,1815324952.00,United States,,100196,Technology,EDP Services
RHLD,Resolute Holdings Management Common Stock ,$68.66,2.44,3.685%,585395023.00,United States,,45733,Finance,Finance: Consumer Services
RIBBR,Ribbon Acquisition Corp Rights,$0.22,0.001,0.457%,0.00,Japan,2025,149,,
RICK,RCI Hospitality Holdings Inc. Common Stock,$35.25,-0.91,-2.517%,307396250.00,United States,1995,72282,Consumer Discretionary,Restaurants
RIGL,Rigel Pharmaceuticals Inc. Common Stock,$40.87,-0.47,-1.137%,733099086.00,United States,2000,841357,Health Care,Biotechnology: Pharmaceutical Preparations
RILY,B. Riley Financial Inc. Common Stock,$5.125,0.15,3.015%,156297463.00,United States,,835256,Finance,Investment Managers
RILYG,B. Riley Financial Inc. 5.00% Senior Notes due 2026,$19.415,-0.405,-2.043%,592100536.00,United States,,20346,Finance,Investment Managers
RILYK,B. Riley Financial Inc. 5.50% Senior Notes Due 2026,$24.04,0.09,0.376%,733149467.00,United States,,9047,Finance,Investment Managers
RILYL,B. Riley Financial Inc. Depositary Shares each representing 1/1000th in a share of 7.375% Series B Cumulative Perpetual Preferred Stock par value $0.0001,$6.10,0.025,0.412%,186032103.00,United States,,5948,Finance,Investment Managers
RILYN,B. Riley Financial Inc. 6.50% Senior Notes Due 2026,$20.63,0.01,0.048%,629154472.00,United States,,9332,Finance,Investment Managers
RILYP,B. Riley Financial Inc. Depositary Shares each representing a 1/1000th fractional interest in a share of Series A Cumulative Perpetual Preferred Stock,$5.98,0.09,1.528%,182372455.00,United States,,3158,Finance,Investment Managers
RILYT,B. Riley Financial Inc. 6.00% Senior Notes Due 2028,$13.89,-0.11,-0.786%,423604247.00,United States,,6790,Finance,Investment Managers
RILYZ,B. Riley Financial Inc. 5.25% Senior Notes due 2028,$12.17,-0.15,-1.218%,371149293.00,United States,,64247,Finance,Investment Managers
RIME,Algorhythm Holdings Inc. Common Stock,$2.02,0.03,1.508%,5079433.00,United States,,76852,Consumer Staples,Diversified Electronic Products
RIOT,Riot Platforms Inc. Common Stock ,$13.44,0.15,1.129%,4967735539.00,United States,,42368585,Finance,Finance: Consumer Services
RITR,Reitar Logtech Holdings Limited Ordinary shares,$5.11,0.26,5.361%,319087563.00,Hong Kong,2024,2562579,Finance,Real Estate
RIVN,Rivian Automotive Inc. Class A Common Stock,$13.99,-0.22,-1.548%,16975941870.00,United States,2021,54533133,Industrials,Auto Manufacturing
RKDA,Arcadia Biosciences Inc. Common Stock,$3.28,0.13,4.127%,4483891.00,United States,2015,11213,Consumer Staples,Farming/Seeds/Milling
RKLB,Rocket Lab Corporation Common Stock,$47.73,1.89,4.123%,22879648181.00,United States,2020,18816228,Industrials,Military/Government/Technical
RLAY,Relay Therapeutics Inc. Common Stock,$4.06,-0.06,-1.456%,699990325.00,United States,2020,1100837,Health Care,Biotechnology: Biological Products (No Diagnostic Substances)
RLMD,Relmada Therapeutics Inc. Common Stock,$1.60,-0.05,-3.03%,53106595.00,United States,,678563,Health Care,Biotechnology: Pharmaceutical Preparations
RLYB,Rallybio Corporation Common Stock,$0.5941,-0.0145,-2.383%,24825342.00,United States,2021,265783,Health Care,Biotechnology: Pharmaceutical Preparations
RMBI,Richmond Mutual Bancorporation Inc. Common Stock,$14.57,-0.15,-1.019%,151910652.00,United States,2019,15474,Finance,Major Banks
RMBS,Rambus Inc. Common Stock,$73.28,-1.53,-2.045%,7884475130.00,United States,1997,1803426,Technology,Semiconductors
RMCF,Rocky Mountain Chocolate Factory Inc. Common Stock,$1.48,-0.06,-3.896%,11535008.00,United States,,55782,Consumer Staples,Specialty Foods
RMCO,Royalty Management Holding Corporation Class A Common Stock,$1.89,-0.13,-6.436%,27830046.00,United States,2023,133574,Miscellaneous,Multi-Sector Companies
RMNI,Rimini Street Inc. (DE) Common Stock,$4.59,0.09,2.00%,424657620.00,United States,2015,284347,Real Estate,Real Estate
RMR,The RMR Group Inc. Class A Common Stock,$17.03,0.20,1.188%,525710804.00,United States,,70618,Consumer Discretionary,Professional Services
RMSG,Real Messenger Corporation Ordinary Shares,$2.87,0.25,9.542%,27469576.00,United States,,185371,Technology,Computer Software: Programming Data Processing
RMSGW,Real Messenger Corporation Warrants,$0.065,0.005,8.333%,622133.00,United States,,1682,Technology,Computer Software: Programming Data Processing
RMTI,Rockwell Medical Inc. Common Stock,$1.59,-0.03,-1.852%,54744260.00,United States,1998,2719610,Health Care,Biotechnology: Pharmaceutical Preparations
RNA,Avidity Biosciences Inc. Common Stock,$48.05,-2.31,-4.587%,6181792843.00,United States,2020,2828474,Health Care,Biotechnology: Pharmaceutical Preparations
RNAC,Cartesian Therapeutics Inc. Common Stock,$10.19,-0.45,-4.229%,264960808.00,United States,2016,33241,Health Care,Biotechnology: Pharmaceutical Preparations
RNAZ,TransCode Therapeutics Inc. Common Stock,$10.86,-0.11,-1.003%,9053797.00,United States,2021,7634,Health Care,Biotechnology: Pharmaceutical Preparations
RNTX,Rein Therapeutics Inc. Common Stock,$1.34,0.01,0.752%,31228845.00,United States,2017,21701,Health Care,Biotechnology: Pharmaceutical Preparations
RNW,ReNew Energy Global plc Class A Ordinary Shares,$7.64,-0.16,-2.051%,2771556260.00,United Kingdom,,455314,Utilities,Electric Utilities: Central
RNWWW,ReNew Energy Global plc Warrant,$0.06,-0.007,-10.448%,21766149.00,United Kingdom,,4436,Utilities,Electric Utilities: Central
RNXT,RenovoRx Inc. Common Stock,$1.14,-0.10,-8.065%,41776308.00,United States,2021,488248,Health Care,Biotechnology: Pharmaceutical Preparations
ROAD,Construction Partners Inc. Class A Common Stock,$123.48,1.02,0.833%,6926006536.00,United States,2018,359331,Industrials,Military/Government/Technical
ROCK,Gibraltar Industries Inc. Common Stock,$60.71,-1.03,-1.668%,1791643590.00,United States,1993,164047,Industrials,Steel/Iron Ore
ROIV,Roivant Sciences Ltd. Common Shares,$12.91,-0.01,-0.077%,8816003302.00,United Kingdom,,5079865,Health Care,Biotechnology: Pharmaceutical Preparations
ROKU,Roku Inc. Class A Common Stock,$99.39,4.15,4.357%,14643191614.00,United States,2017,4383649,Telecommunications,Cable & Other Pay Television Services
ROMA,Roma Green Finance Limited Ordinary Shares,$2.53,0.1036,4.27%,150698365.00,Hong Kong,2024,22490,Consumer Discretionary,Professional Services
ROOT,Root Inc. Class A Common Stock,$100.74,8.10,8.744%,1556164427.00,United States,2020,715826,Finance,Property-Casualty Insurers
ROP,Roper Technologies Inc. Common Stock,$523.43,4.99,0.963%,56328303896.00,United States,1992,1085950,Technology,Computer Software: Programming Data Processing
ROST,Ross Stores Inc. Common Stock,$151.57,0.62,0.411%,49574078868.00,United States,1985,2393415,Consumer Discretionary,Clothing/Shoe/Accessory Stores
RPAY,Repay Holdings Corporation Class A Common Stock,$5.92,0.04,0.68%,509398039.00,United States,2018,477328,Real Estate,Real Estate
RPD,Rapid7 Inc. Common Stock,$20.60,0.28,1.378%,1333766529.00,United States,2015,729855,Technology,Computer Software: Prepackaged Software
RPID,Rapid Micro Biosystems Inc. Class A Common Stock,$2.72,0.00,0.00%,120252092.00,United States,2021,45212,Industrials,Biotechnology: Laboratory Analytical Instruments
RPRX,Royalty Pharma plc Class A Ordinary Shares ,$35.80,-0.27,-0.749%,20877639868.00,United States,2020,8546302,Health Care,Biotechnology: Pharmaceutical Preparations
RPTX,Repare Therapeutics Inc. Common Shares,$1.71,0.02,1.183%,73460184.00,Canada,2020,106196,Health Care,Biotechnology: Pharmaceutical Preparations
RR,Richtech Robotics Inc. Class B Common Stock,$2.98,0.45,17.787%,446684057.00,United States,2023,37612300,Industrials,Industrial Machinery/Components
RRBI,Red River Bancshares Inc. Common Stock,$65.45,1.09,1.694%,436984059.00,United States,2019,9884,Consumer Discretionary,Hotels/Resorts
RRGB,Red Robin Gourmet Burgers Inc. Common Stock,$6.15,-0.02,-0.324%,110146844.00,United States,2002,202206,Consumer Discretionary,Restaurants
RRR,Red Rock Resorts Inc. Class A Common Stock,$61.37,-0.89,-1.429%,6474020842.00,United States,2016,534710,Consumer Discretionary,Hotels/Resorts
RSSS,Research Solutions Inc Common Stock,$3.16,-0.16,-4.819%,102569577.00,United States,,193241,Real Estate,Real Estate
RSVR,Reservoir Media Inc. Common Stock,$7.90,-0.03,-0.378%,517916282.00,United States,2021,34394,Consumer Discretionary,Services-Misc. Amusement & Recreation
RTAC,Renatus Tactical Acquisition Corp I Class A Ordinary Shares,$10.53,-0.01,-0.095%,0.00,United States,2025,325974,Finance,Blank Checks
RTACU,Renatus Tactical Acquisition Corp I Unit,$11.02,0.04,0.364%,0.00,United States,2025,17616,Finance,Blank Checks
RTACW,Renatus Tactical Acquisition Corp I Warrant,$1.02,-0.02,-1.923%,0.00,United States,2025,173295,Finance,Blank Checks
RUBI,Rubico Inc. Common Stock,$2.45,0.0138,0.566%,7674226.00,Greece,,47521,Consumer Discretionary,Marine Transportation
RUM,Rumble Inc. Class A Common Stock,$7.31,0.20,2.813%,3177429118.00,United States,2021,1762723,Technology,Computer Software: Programming Data Processing
RUMBW,Rumble Inc. Warrant,$2.2689,0.0689,3.132%,986220099.00,United States,2021,252,Technology,Computer Software: Programming Data Processing
RUN,Sunrun Inc. Common Stock,$16.92,-1.26,-6.931%,3903995118.00,United States,2015,12273163,Miscellaneous,Industrial Machinery/Components
RUSHA,Rush Enterprises Inc. Common Stock Cl A,$58.08,-0.16,-0.275%,4522083593.00,United States,,269348,Consumer Discretionary,Retail-Auto Dealers and Gas Stations
RUSHB,Rush Enterprises Inc. Class B,$58.98,-0.18,-0.304%,4592157203.00,United States,,35278,Consumer Discretionary,Retail-Auto Dealers and Gas Stations
RVMD,Revolution Medicines Inc. Common Stock,$41.06,0.56,1.383%,7675476781.00,United States,2020,1794875,Health Care,Biotechnology: Biological Products (No Diagnostic Substances)
RVMDW,Revolution Medicines Inc. Warrant,$0.2225,0.0225,11.25%,41592635.00,United States,,17598,,
RVPH,Reviva Pharmaceuticals Holdings Inc. Common Stock ,$0.447,0.008,1.822%,30397615.00,United States,2020,837023,Health Care,Biotechnology: Pharmaceutical Preparations
RVPHW,Reviva Pharmaceuticals Holdings Inc. Warrants,$0.0556,-0.014,-20.115%,3781001.00,United States,2018,47721,Health Care,Biotechnology: Pharmaceutical Preparations
RVSB,Riverview Bancorp Inc Common Stock,$5.05,0.01,0.198%,105789309.00,United States,,48663,Finance,Savings Institutions
RVSN,Rail Vision Ltd. Ordinary Share,$0.3941,-0.0175,-4.252%,20488545.00,Israel,2022,1315812,Industrials,Railroads
RVSNW,Rail Vision Ltd. Warrant,$0.09,0.00,0.00%,4678937.00,Israel,2022,200,Industrials,Railroads
RVYL,Ryvyl Inc. Common Stock,$0.2966,0.0214,7.776%,9296040.00,United States,,2279513,Consumer Discretionary,Professional Services
RWAY,Runway Growth Finance Corp. Common Stock,$10.64,-0.06,-0.561%,385344964.00,United States,2021,196457,Finance,Finance: Consumer Services
RWAYL,Runway Growth Finance Corp. 7.50% Notes due 2027,$25.2401,-0.0062,-0.025%,914111413.00,United States,,3604,Finance,Finance: Consumer Services
RWAYZ,Runway Growth Finance Corp. 8.00% Notes due 2027,$25.26,-0.04,-0.158%,914832124.00,United States,,3705,Finance,Finance: Consumer Services
RXRX,Recursion Pharmaceuticals Inc. Class A Common Stock,$4.62,0.01,0.217%,2005780092.00,United States,2021,15138264,Health Care,Biotechnology: Biological Products (No Diagnostic Substances)
RXST,RxSight Inc. Common Stock,$8.94,0.05,0.562%,365788709.00,United States,2021,927333,Health Care,Ophthalmic Goods
RXT,Rackspace Technology Inc. Common Stock,$1.45,0.05,3.571%,347072982.00,United States,2020,957961,Technology,Computer Software: Programming Data Processing
RYAAY,Ryanair Holdings plc American Depositary Shares,$59.81,-0.70,-1.157%,31679791413.00,Ireland,1997,1202110,Consumer Discretionary,Air Freight/Delivery Services
RYET,Ruanyun Edai Technology Inc. Ordinary shares,$1.39,0.02,1.46%,46912506.00,China,2025,51777,Technology,Computer Software: Prepackaged Software
RYM,RYTHM Inc. Common Stock,$36.67,0.255,0.70%,73434169.00,United States,2021,10751,Consumer Staples,Farming/Seeds/Milling
RYOJ,rYojbaba Co. Ltd. Common Shares,$2.10,0.18,9.375%,23625000.00,Japan,2025,33350,Consumer Discretionary,Professional Services
RYTM,Rhythm Pharmaceuticals Inc. Common Stock,$99.77,-2.35,-2.301%,6626732479.00,United States,2017,934610,Health Care,Biotechnology: Pharmaceutical Preparations
RZLT,Rezolute Inc. Common Stock (NV),$7.95,-0.05,-0.625%,679878578.00,United States,,687643,Health Care,Biotechnology: Pharmaceutical Preparations
RZLV,Rezolve AI PLC Ordinary Shares,$4.62,0.35,8.197%,1125761748.00,United Kingdom,,15072562,Technology,Computer Software: Programming Data Processing
RZLVW,Rezolve AI PLC Warrants,$1.2025,0.1525,14.524%,293014827.00,United Kingdom,,175041,Technology,Computer Software: Programming Data Processing
SABR,Sabre Corporation Common Stock,$1.74,0.03,1.754%,686455028.00,United States,2014,3951362,Technology,Computer Software: Programming Data Processing
SABS,SAB Biotherapeutics Inc. Common Stock,$2.10,-0.17,-7.489%,21863228.00,United States,2021,154720,Health Care,Biotechnology: Biological Products (No Diagnostic Substances)
SABSW,SAB Biotherapeutics Inc. Warrant,$0.026,0.0007,2.767%,270688.00,United States,2021,10083,Health Care,Biotechnology: Biological Products (No Diagnostic Substances)
SAFT,Safety Insurance Group Inc. Common Stock,$73.52,0.94,1.295%,1095019599.00,United States,2002,159363,Finance,Property-Casualty Insurers
SAFX,XCF Global Inc. Class A Common Stock,$1.34,-0.06,-4.286%,200015014.00,United States,,411339,Industrials,Major Chemicals
SAGT,SAGTEC GLOBAL LIMITED Ordinary shares,$1.92,-0.04,-2.041%,24096000.00,Malaysia,2025,44281,Technology,Computer Software: Prepackaged Software
SAIA,Saia Inc. Common Stock,$312.06,-1.09,-0.348%,8312044515.00,United States,,562565,Industrials,Trucking Freight/Courier Services
SAIC,Science Applications International Corporation Common Stock,$102.60,-2.33,-2.221%,4721857303.00,United States,,863385,Technology,EDP Services
SAIH,SAIHEAT Limited Class A Ordinary Shares,$5.6501,-0.4999,-8.128%,9904343.00,Singapore,2021,4670,Technology,EDP Services
SAIHW,SAIHEAT Limited Warrant,$0.0861,0.00,0.00%,150929.00,Singapore,2021,200,Technology,EDP Services
SAIL,SailPoint Inc. Common Stock,$22.39,0.41,1.865%,12462024352.00,United States,2025,5068734,Technology,Computer Software: Prepackaged Software
SAMG,Silvercrest Asset Management Group Inc. Class A Common Stock,$16.215,0.395,2.497%,203774716.00,United States,2013,19333,Finance,Investment Managers
SANA,Sana Biotechnology Inc. Common Stock,$3.00,0.04,1.351%,713419494.00,United States,2021,2550714,Health Care,Biotechnology: Biological Products (No Diagnostic Substances)
SANG,Sangoma Technologies Corporation Common Shares,$5.61,0.11,2.00%,187968093.00,Canada,,3412,Technology,Computer Software: Programming Data Processing
SANM,Sanmina Corporation Common Stock,$118.92,-2.01,-1.662%,6336586794.00,United States,1993,636793,Technology,Electrical Products
SATL,Satellogic Inc. Class A Common Stock,$3.60,0.10,2.857%,380045963.00,Uruguay,,1002868,Technology,Radio And Television Broadcasting And Communications Equipment
SATLW,Satellogic Inc. Warrant,$0.427,-0.0206,-4.602%,45077674.00,Uruguay,,12305,Technology,Radio And Television Broadcasting And Communications Equipment
SATS,EchoStar  Corporation Common Stock,$80.63,13.39,19.914%,23198575912.00,United States,,24224011,Consumer Discretionary,Telecommunications Equipment
SAVA,Cassava Sciences Inc. Common Stock,$2.14,-0.02,-0.926%,103378897.00,United States,,405461,Health Care,Biotechnology: Pharmaceutical Preparations
SBAC,SBA Communications Corporation Class A Common Stock,$191.35,-6.39,-3.232%,20546974138.00,United States,1999,2436403,Real Estate,Real Estate Investment Trusts
SBC,SBC Medical Group Holdings Incorporated Common Stock,$4.99,0.84,20.241%,518367442.00,United States,2022,211129,Health Care,Medical/Nursing Services
SBCF,Seacoast Banking Corporation of Florida Common Stock,$31.08,-0.27,-0.861%,2730524542.00,United States,,572173,Finance,Major Banks
